{
  "schemaVersion": 1,
  "id": "claude:0f8c2a6e-1111-4222-8333-944455556666",
  "provider": "claude",
  "sessionId": "0f8c2a6e-1111-4222-8333-944455556666",
  "sourceKey": "2c26b46b68ffc68ff99b453c1d30413413422d706483bfa0f98a5e886266e7ae",
  "cwd": "C:/Users/example/Projects/workspace/apps/demo",
  "project": "apps/demo",
  "gitBranch": "feature/greeting",
  "startedAt": "2026-10-19T14:00:00.000Z",
  "endedAt": "2026-10-19T15:10:00.000Z",
  "entrypoint": "cli",
  "automated": false,
  "parentId": null,
  "models": [{ "value": "claude-opus-5-5", "turns": 3 }],
  "efforts": [{ "value": "high", "turns": 3 }],
  "userMessages": [
    { "turn": 0, "at": "2026-10-19T14:00:00.000Z", "kind": "prompt", "text": "Add a Spanish greeting. Requirements: R1 greet(name,'es') returns Hola. Acceptance: node --test passes.", "chars": 104 },
    { "turn": 1, "at": "2026-10-19T14:30:00.000Z", "kind": "prompt", "text": "no funciona, sigue saliendo Hello en español", "chars": 44 },
    { "turn": 1, "at": "2026-10-19T14:31:00.000Z", "kind": "interrupt", "text": "", "chars": 0 },
    { "turn": 2, "at": "2026-10-19T14:50:00.000Z", "kind": "prompt", "text": "ok commit it", "chars": 12 }
  ],
  "turns": [
    { "i": 0, "startedAt": "2026-10-19T14:00:00.000Z", "endedAt": "2026-10-19T14:20:00.000Z", "userChars": 104, "model": "claude-opus-5-5", "effort": "high",
      "interrupted": false, "toolCalls": 6, "toolErrors": 1, "toolCounts": { "read": 2, "edit": 2, "shell": 2 },
      "events": [ { "category": "test", "failed": false, "cwd": null } ],
      "tokens": { "input": 52000, "cached": 40000, "cacheWrite": 9000, "output": 3100, "reasoning": 900, "total": 55100 },
      "agentFinal": { "text": "Done: Spanish greeting implemented and tests pass.", "chars": 51 } },
    { "i": 1, "startedAt": "2026-10-19T14:30:00.000Z", "endedAt": "2026-10-19T14:31:00.000Z", "userChars": 44, "model": "claude-opus-5-5", "effort": "high",
      "interrupted": true, "toolCalls": 1, "toolErrors": 0, "toolCounts": { "read": 1 }, "events": [],
      "tokens": { "input": 56000, "cached": 52000, "cacheWrite": 1000, "output": 200, "reasoning": 0, "total": 56200 }, "agentFinal": null },
    { "i": 2, "startedAt": "2026-10-19T14:50:00.000Z", "endedAt": "2026-10-19T15:10:00.000Z", "userChars": 12, "model": "claude-opus-5-5", "effort": "high",
      "interrupted": false, "toolCalls": 5, "toolErrors": 0, "toolCounts": { "edit": 1, "shell": 4 },
      "events": [ { "category": "test", "failed": false, "cwd": null }, { "category": "git-commit", "failed": false, "commits": ["a1b2c3d"], "cwd": null } ],
      "tokens": { "input": 60000, "cached": 56000, "cacheWrite": 2000, "output": 1500, "reasoning": 300, "total": 61500 },
      "agentFinal": { "text": "Committed a1b2c3d after node --test passed.", "chars": 44 } }
  ],
  "compactions": [ { "at": "2026-10-19T14:45:00.000Z", "trigger": "auto", "turn": 2 } ],
  "tokens": { "input": 168000, "cached": 148000, "cacheWrite": 12000, "output": 4800, "reasoning": 1200, "total": 172800 },
  "coverage": { "complete": true, "bytes": 182345, "lines": 212, "skippedLines": 0, "oversizedLines": 0, "unknownEvents": 3 },
  "redactions": 0
}
